{
  "$schema": "../../../tools/schemas/palette.schema.json",
  "schema": "html-js-gaming.palette",
  "version": 1,
  "name": "Sample 1414 Palette",
  "source": "engine/paletteList",
  "swatches": [
    {
      "symbol": "!",
      "hex": "#1CAC78",
      "name": "color-001"
    },
    {
      "symbol": "#",
      "hex": "#FB923C",
      "name": "color-002"
    },
    {
      "symbol": "$",
      "hex": "#FDBA74",
      "name": "color-003"
    },
    {
      "symbol": "%",
      "hex": "#F59E0B",
      "name": "color-004"
    },
    {
      "symbol": "&",
      "hex": "#FFFBEB",
      "name": "color-005"
    },
    {
      "symbol": "(",
      "hex": "#1F75FE",
      "name": "color-006"
    },
    {
      "symbol": ")",
      "hex": "#FF7538",
      "name": "color-007"
    }
  ],
  "sourceId": "crayola008",
  "locked": true
}
