{
  "$schema": "../../../../../tools/schemas/palette.schema.json",
  "schema": "html-js-gaming.palette",
  "version": 1,
  "name": "Vector Native Primary Palette",
  "source": "custom",
  "swatches": [
    {
      "symbol": "!",
      "hex": "#05070D",
      "name": "Swatch 1"
    },
    {
      "symbol": "#",
      "hex": "#E8F0FF",
      "name": "Swatch 2"
    },
    {
      "symbol": "$",
      "hex": "#6FD3FF",
      "name": "Swatch 3"
    },
    {
      "symbol": "%",
      "hex": "#FFB347",
      "name": "Swatch 4"
    }
  ]
}
