{
  "$schema": "../../../tools/schemas/palette.schema.json",
  "schema": "html-js-gaming.palette",
  "version": 1,
  "name": "Sample 0219 Palette",
  "source": "generated-from-sample-colors",
  "swatches": [
    {
      "symbol": "!",
      "hex": "#1CAC78",
      "name": "color-001"
    },
    {
      "symbol": "#",
      "hex": "#7DD3FC",
      "name": "color-002"
    },
    {
      "symbol": "$",
      "hex": "#FFFFFF",
      "name": "color-003"
    },
    {
      "symbol": "%",
      "hex": "#60A5FA",
      "name": "color-004"
    },
    {
      "symbol": "&",
      "hex": "#34D399",
      "name": "color-005"
    },
    {
      "symbol": "(",
      "hex": "#10B981",
      "name": "color-006"
    },
    {
      "symbol": ")",
      "hex": "#1F75FE",
      "name": "color-007"
    },
    {
      "symbol": "*",
      "hex": "#FF7538",
      "name": "color-008"
    }
  ]
}
