{
  "$schema": "../../../tools/schemas/tools/palette-browser.schema.json",
  "schema": "html-js-gaming.palette",
  "version": 1,
  "name": "Sample 0207 Palette",
  "source": "sample-js",
  "sourceId": "sample-0207",
  "locked": true,
  "swatches": [
    {
      "symbol": "!",
      "hex": "#7DD3FC",
      "name": "color-001"
    },
    {
      "symbol": "#",
      "hex": "#60A5FA",
      "name": "color-002"
    },
    {
      "symbol": "$",
      "hex": "#34D399",
      "name": "color-003"
    },
    {
      "symbol": "%",
      "hex": "#10B981",
      "name": "color-004"
    },
    {
      "symbol": "&",
      "hex": "#059669",
      "name": "color-005"
    },
    {
      "symbol": "(",
      "hex": "#D8D5FF",
      "name": "color-006"
    },
    {
      "symbol": ")",
      "hex": "#FFFFFF",
      "name": "color-007"
    }
  ]
}
