{
  "$schema": "../../../tools/schemas/tools/palette-browser.schema.json",
  "schema": "html-js-gaming.palette",
  "version": 1,
  "name": "Sample 0302 Palette",
  "source": "sample-js",
  "sourceId": "sample-0302",
  "locked": true,
  "swatches": [
    {
      "symbol": "!",
      "hex": "#1F2937",
      "name": "color-001"
    },
    {
      "symbol": "#",
      "hex": "#4338CA",
      "name": "color-002"
    },
    {
      "symbol": "$",
      "hex": "#FBBF24",
      "name": "color-003"
    },
    {
      "symbol": "%",
      "hex": "#D8D5FF",
      "name": "color-004"
    }
  ]
}
