{
  "$schema": "../../../toolbox/schemas/palette.schema.json",
  "schema": "html-js-gaming.palette",
  "version": 1,
  "name": "Sample 0313 Palette",
  "source": "generated-from-sample-colors",
  "swatches": [
    {
      "symbol": "!",
      "hex": "#111827",
      "name": "color-001"
    },
    {
      "symbol": "#",
      "hex": "#1CAC78",
      "name": "color-002"
    },
    {
      "symbol": "$",
      "hex": "#1F75FE",
      "name": "color-003"
    },
    {
      "symbol": "%",
      "hex": "#EE204D",
      "name": "color-004"
    },
    {
      "symbol": "&",
      "hex": "#FCE883",
      "name": "color-005"
    }
  ]
}
